{
  "capsule_id": "capsule_agent_loop_planner_gate6_1782025877515",
  "loop_run_id": "loop_gate6_validate_project_name",
  "agent_id": "agent_loop_planner_gate6",
  "agent_type": "planner",
  "old_thread_id": "019ede52-ccc2-7423-9249-0b225a5d2df4",
  "new_thread_id": null,
  "restart_reason": "PreCompact hook requested a context capsule draft.",
  "current_module": "Gate6",
  "current_task": "task_gate6_plan",
  "completed_modules": [
    "M0",
    "M1",
    "M2",
    "M3",
    "M4",
    "M5",
    "M6",
    "M7",
    "M8",
    "M9",
    "M10"
  ],
  "completed_work": [],
  "open_issues": [],
  "evaluator_findings": [],
  "repair_requests": [],
  "decisions": [
    "DEC-0055",
    "DEC-0056",
    "DEC-0058",
    "DEC-0054"
  ],
  "validation_status": {
    "commands_run": [
      {
        "command": "sed -n '1,260p' src/orchestrator/validate-dev-worker-result.ts && sed -n '1,220p' src/orchestrator/parse-dev-worker-lite-output.ts && sed -n '1,180p' src/orchestrator/dev-worker-lite-output.ts"
      },
      {
        "command": "npm run typecheck"
      },
      {
        "command": "npm run typecheck"
      },
      {
        "command": "npm test -- tests/orchestrator/sdk-repair-loop-checkpoint-state.test.ts tests/orchestrator/create-repair-request-from-eval.test.ts tests/orchestrator/write-final-delivery-report.test.ts tests/runtime/gate6b2-repair-loop-script.test.ts"
      },
      {
        "command": "npm run typecheck"
      },
      {
        "command": "npm run typecheck"
      },
      {
        "command": "npm test"
      },
      {
        "command": "npm run validate"
      },
      {
        "command": "git status --short src/orchestrator/sdk-repair-loop-types.ts src/orchestrator/sdk-repair-loop-checkpoint-state.ts src/orchestrator/create-repair-request-from-eval.ts src/orchestrator/write-final-delivery-report.ts src/orchestrator/sdk-dev-worker-stage.ts src/orchestrator/sdk-dev-worker-stage-types.ts src/orchestrator/sdk-evaluator-stage.ts src/orchestrator/sdk-evaluator-stage-types.ts src/orchestrator/index.ts scripts/sdk-orchestrated/gate6b2-utils.ts scripts/sdk-orchestrated/prepare-gate6b2-repair-loop.ts scripts/sdk-orchestrated/run-gate6b2-planner.ts scripts/sdk-orchestrated/run-gate6b2-dev-worker.ts scripts/sdk-orchestrated/run-gate6b2-initial-evaluator.ts scripts/sdk-orchestrated/create-gate6b2-repair-request.ts scripts/sdk-orchestrated/run-gate6b2-repair-dev-worker.ts scripts/sdk-orchestrated/run-gate6b2-final-evaluator.ts scripts/sdk-orchestrated/write-gate6b2-final-report.ts scripts/sdk-orchestrated/verify-gate6b2-repair-loop.ts scripts/sdk-orchestrated/report-gate6b2-repair-loop.ts tests/orchestrator/sdk-repair-loop-checkpoint-state.test.ts tests/orchestrator/create-repair-request-from-eval.test.ts tests/orchestrator/write-final-delivery-report.test.ts tests/runtime/gate6b2-repair-loop-script.test.ts package.json docs/GATE6B_SDK_ORCHESTRATED_VALIDATION.md docs/SDK_ORCHESTRATED_MODE_PLAN.md docs/LOOP_PROGRESS.md docs/DECISIONS.md evals/sdk-orchestrated/reports/gate6b2-repair-loop-state.json evals/sdk-orchestrated/reports/gate6b2-repair-loop-verify.json evals/sdk-orchestrated/reports/Gate6B2_Repair_Loop_Report.md tmp/sdk-orchestrated/gate6b2-repair-loop-target"
      }
    ],
    "passed": [],
    "failed": [],
    "not_run_reason": ""
  },
  "files_changed_recently": [
    {
      "path": "docs/PRD.md",
      "purpose": "Product requirements"
    },
    {
      "path": "docs/ACCEPTANCE_CRITERIA.md",
      "purpose": "Acceptance criteria"
    },
    {
      "path": "docs/TASK_GRAPH.json",
      "purpose": "Task decomposition"
    }
  ],
  "source_of_truth_files": [
    "README.md",
    "package.json",
    "src/project-name.js",
    "test/project-name.test.js",
    "docs/PRD.md",
    "docs/ACCEPTANCE_CRITERIA.md",
    "docs/TASK_GRAPH.json"
  ],
  "next_instruction": "Continue Gate6 from docs/LOOP_PROGRESS.md and latest events.",
  "do_not_repeat": [
    "Do not rely on chat history as the only source of truth.",
    "Do not enter the next module unless explicitly requested."
  ],
  "risks": [],
  "created_at": "2026-06-21T07:11:17.514Z",
  "updated_at": "2026-06-21T07:11:17.514Z"
}
