{
  "capsule_id": "capsule_agent_loop_planner_gate6_1782475719245",
  "loop_run_id": "repair-loop-001",
  "agent_id": "agent_loop_planner_gate6",
  "agent_type": "planner",
  "old_thread_id": "019ede52-ccc2-7423-9249-0b225a5d2df4",
  "new_thread_id": null,
  "restart_reason": "PreCompact hook requested a context capsule draft.",
  "current_module": "M1",
  "current_task": "task_unassigned",
  "completed_modules": [
    "M0",
    "M1",
    "M2",
    "M3",
    "M4",
    "M5",
    "M6",
    "M7",
    "M8",
    "M9",
    "M10"
  ],
  "completed_work": [],
  "open_issues": [],
  "evaluator_findings": [],
  "repair_requests": [],
  "decisions": [
    "DEC-0055",
    "DEC-0056",
    "DEC-0058",
    "DEC-0054"
  ],
  "validation_status": {
    "commands_run": [
      {
        "command": "sed -n '1,140p' tests/effectiveness/adversarial-dev-worker-smoke-target.test.ts"
      },
      {
        "command": "rg -n \"smoke-security-summary|git_diff_files|allowedFiles|collectSmokeFileChangeProof|dev_result_changed_files\" scripts/effectiveness/run-adversarial-dev-worker-smoke.ts src/effectiveness/adversarial-dev-worker-smoke-target.ts tests/effectiveness/adversarial-dev-worker-smoke-target.test.ts tests/effectiveness/adversarial-dev-worker-smoke.test.ts"
      },
      {
        "command": "npm test -- tests/effectiveness/adversarial-dev-worker-smoke-target.test.ts"
      },
      {
        "command": "npm test"
      },
      {
        "command": "npm run validate"
      },
      {
        "command": "git diff -- src/effectiveness/adversarial-security-contract.ts scripts/effectiveness/verify-adversarial-exact-completion-recovery.ts scripts/effectiveness/report-adversarial-exact-completion-recovery.ts scripts/effectiveness/run-adversarial-exact-completion-recovery.ts scripts/effectiveness/triage-adversarial-completion-security-contract.ts evals/effectiveness/fixtures/adversarial-prompt-injection-001/scripts/check-security-contract.js tests/effectiveness/adversarial-security-contract.test.ts tests/effectiveness/adversarial-exact-completion-recovery.test.ts tests/effectiveness/adversarial-dev-worker-smoke-target.test.ts | sed -n '1,260p'"
      },
      {
        "command": "target=$(node -e 'const fs=require(\"fs\"); const r=JSON.parse(fs.readFileSync(\"evals/effectiveness/reports/adversarial-prompt-injection-001/adversarial-dev-worker-smoke-result.json\",\"utf8\")); process.stdout.write(r.working_directory)'); printf '%s\\n' '--- npm test log-ish via package scripts check'; node -e 'const fs=require(\"fs\"); const p=process.argv[1]+\"/package.json\"; console.log(fs.readFileSync(p,\"utf8\"))' \"$target\" | sed -n '1,120p'; printf '\\n--- security contract manual evidence (no run)\\n'; node -e 'const fs=require(\"fs\"); const p=process.argv[1]+\"/scripts/check-security-contract.js\"; console.log(fs.readFileSync(p,\"utf8\"))' \"$target\" | sed -n '1,220p'; printf '\\n--- stdout\\n'; sed -n '1,120p' evals/effectiveness/reports/adversarial-prompt-injection-001/sdk-stage-logs/adversarial-dev-worker-smoke-exact-stdout.log; printf '\\n--- stderr\\n'; sed -n '1,120p' evals/effectiveness/reports/adversarial-prompt-injection-001/sdk-stage-logs/adversarial-dev-worker-smoke-exact-stderr.log"
      }
    ],
    "passed": [],
    "failed": [],
    "not_run_reason": ""
  },
  "files_changed_recently": [],
  "source_of_truth_files": [
    "package.json",
    "src/project-name.js",
    "test/project-name.test.js",
    "artifacts/eval-report-needs-revision.json",
    "artifacts/repair-request.json",
    "artifacts/dev-result.json",
    "artifacts/eval-report-pass.json"
  ],
  "next_instruction": "Continue M1 from docs/LOOP_PROGRESS.md and latest events.",
  "do_not_repeat": [
    "Do not rely on chat history as the only source of truth.",
    "Do not enter the next module unless explicitly requested."
  ],
  "risks": [],
  "created_at": "2026-06-26T12:08:39.244Z",
  "updated_at": "2026-06-26T12:08:39.244Z"
}
