{
  "capsule_id": "capsule_agent_loop_planner_gate6_1782206132205",
  "loop_run_id": "repair-loop-001",
  "agent_id": "agent_loop_planner_gate6",
  "agent_type": "planner",
  "old_thread_id": "019ede52-ccc2-7423-9249-0b225a5d2df4",
  "new_thread_id": null,
  "restart_reason": "PreCompact hook requested a context capsule draft.",
  "current_module": "M1",
  "current_task": "task_unassigned",
  "completed_modules": [
    "M0",
    "M1",
    "M2",
    "M3",
    "M4",
    "M5",
    "M6",
    "M7",
    "M8",
    "M9",
    "M10"
  ],
  "completed_work": [],
  "open_issues": [],
  "evaluator_findings": [],
  "repair_requests": [],
  "decisions": [
    "DEC-0055",
    "DEC-0056",
    "DEC-0058",
    "DEC-0054"
  ],
  "validation_status": {
    "commands_run": [
      {
        "command": "npm run typecheck"
      },
      {
        "command": "npm test"
      },
      {
        "command": "npm run validate"
      },
      {
        "command": "npm test"
      },
      {
        "command": "npm run validate"
      },
      {
        "command": "git diff -- src/effectiveness/feature-evaluator-smoke-readiness.ts scripts/effectiveness/run-feature-evaluator-smoke.ts scripts/effectiveness/verify-feature-evaluator-smoke.ts scripts/effectiveness/report-feature-evaluator-smoke.ts scripts/effectiveness/check-feature-evaluator-smoke-readiness.ts tests/effectiveness/feature-evaluator-smoke-readiness.test.ts tests/effectiveness/feature-evaluator-smoke.test.ts package.json docs/M12_EFFECTIVENESS_EVALUATION.md docs/M12_RELEASE_GATES.md docs/LOOP_PROGRESS.md docs/DECISIONS.md evals/effectiveness/reports/feature-small-001/feature-evaluator-smoke-result.json evals/effectiveness/reports/feature-small-001/feature-evaluator-smoke-readiness.json evals/effectiveness/reports/feature-small-001/FeatureEvaluatorSmokeReport.md | sed -n '1,260p'"
      }
    ],
    "passed": [],
    "failed": [],
    "not_run_reason": ""
  },
  "files_changed_recently": [],
  "source_of_truth_files": [
    "package.json",
    "src/project-name.js",
    "test/project-name.test.js",
    "artifacts/eval-report-needs-revision.json",
    "artifacts/repair-request.json",
    "artifacts/dev-result.json",
    "artifacts/eval-report-pass.json"
  ],
  "next_instruction": "Continue M1 from docs/LOOP_PROGRESS.md and latest events.",
  "do_not_repeat": [
    "Do not rely on chat history as the only source of truth.",
    "Do not enter the next module unless explicitly requested."
  ],
  "risks": [],
  "created_at": "2026-06-23T09:15:32.204Z",
  "updated_at": "2026-06-23T09:15:32.204Z"
}
