{
  "capsule_id": "capsule_agent_loop_planner_gate6_1782019417145",
  "loop_run_id": "loop_gate6_validate_project_name",
  "agent_id": "agent_loop_planner_gate6",
  "agent_type": "planner",
  "old_thread_id": "019ede52-ccc2-7423-9249-0b225a5d2df4",
  "new_thread_id": null,
  "restart_reason": "PreCompact hook requested a context capsule draft.",
  "current_module": "Gate6",
  "current_task": "task_gate6_plan",
  "completed_modules": [
    "M0",
    "M1",
    "M2",
    "M3",
    "M4",
    "M5",
    "M6",
    "M7",
    "M8",
    "M9",
    "M10"
  ],
  "completed_work": [],
  "open_issues": [],
  "evaluator_findings": [],
  "repair_requests": [],
  "decisions": [
    "DEC-0055",
    "DEC-0056",
    "DEC-0054"
  ],
  "validation_status": {
    "commands_run": [
      {
        "command": "sed -n '1,260p' tests/orchestrator/sdk-evaluator-stage.test.ts"
      },
      {
        "command": "sed -n '1,260p' tests/orchestrator/sdk-checkpoint-state.test.ts"
      },
      {
        "command": "sed -n '1,240p' tests/runtime/gate6b-checkpoint-script.test.ts"
      },
      {
        "command": "npm run typecheck"
      },
      {
        "command": "npm run typecheck"
      },
      {
        "command": "npx vitest run tests/orchestrator/parse-evaluator-lite-output.test.ts tests/orchestrator/hydrate-eval-report.test.ts tests/orchestrator/validate-eval-report-artifacts.test.ts tests/orchestrator/sdk-evaluator-stage.test.ts tests/runtime/gate6b-evaluator-smoke-script.test.ts tests/runtime/gate6b-checkpoint-script.test.ts"
      },
      {
        "command": "npm run typecheck"
      },
      {
        "command": "npm test"
      },
      {
        "command": "npm run validate"
      },
      {
        "command": "git status --short src/orchestrator/parse-evaluator-lite-output.ts src/orchestrator/hydrate-eval-report.ts src/orchestrator/validate-eval-report-artifacts.ts scripts/sdk-orchestrated/run-gate6b-evaluator-smoke.ts scripts/sdk-orchestrated/verify-gate6b-evaluator-smoke.ts scripts/sdk-orchestrated/report-gate6b-evaluator-smoke.ts tests/orchestrator/parse-evaluator-lite-output.test.ts tests/orchestrator/hydrate-eval-report.test.ts tests/orchestrator/validate-eval-report-artifacts.test.ts tests/orchestrator/sdk-evaluator-stage.test.ts tests/runtime/gate6b-evaluator-smoke-script.test.ts tests/runtime/gate6b-checkpoint-script.test.ts evals/sdk-orchestrated/reports/sdk-startup-triage/evaluator-smoke-result.json evals/sdk-orchestrated/reports/sdk-startup-triage/evaluator-smoke-verify.json evals/sdk-orchestrated/reports/sdk-startup-triage/EvaluatorSmokeReport.md evals/sdk-orchestrated/reports/gate6b-checkpoint-evaluator-result.json evals/sdk-orchestrated/reports/gate6b-checkpoint-verify.json"
      }
    ],
    "passed": [],
    "failed": [],
    "not_run_reason": ""
  },
  "files_changed_recently": [
    {
      "path": "docs/PRD.md",
      "purpose": "Product requirements"
    },
    {
      "path": "docs/ACCEPTANCE_CRITERIA.md",
      "purpose": "Acceptance criteria"
    },
    {
      "path": "docs/TASK_GRAPH.json",
      "purpose": "Task decomposition"
    }
  ],
  "source_of_truth_files": [
    "README.md",
    "package.json",
    "src/project-name.js",
    "test/project-name.test.js",
    "docs/PRD.md",
    "docs/ACCEPTANCE_CRITERIA.md",
    "docs/TASK_GRAPH.json"
  ],
  "next_instruction": "Continue Gate6 from docs/LOOP_PROGRESS.md and latest events.",
  "do_not_repeat": [
    "Do not rely on chat history as the only source of truth.",
    "Do not enter the next module unless explicitly requested."
  ],
  "risks": [],
  "created_at": "2026-06-21T05:23:37.144Z",
  "updated_at": "2026-06-21T05:23:37.144Z"
}
