{
  "capsule_id": "capsule_agent_loop_planner_gate6_1782392575197",
  "loop_run_id": "repair-loop-001",
  "agent_id": "agent_loop_planner_gate6",
  "agent_type": "planner",
  "old_thread_id": "019ede52-ccc2-7423-9249-0b225a5d2df4",
  "new_thread_id": null,
  "restart_reason": "PreCompact hook requested a context capsule draft.",
  "current_module": "M1",
  "current_task": "task_unassigned",
  "completed_modules": [
    "M0",
    "M1",
    "M2",
    "M3",
    "M4",
    "M5",
    "M6",
    "M7",
    "M8",
    "M9",
    "M10"
  ],
  "completed_work": [],
  "open_issues": [],
  "evaluator_findings": [],
  "repair_requests": [],
  "decisions": [
    "DEC-0055",
    "DEC-0056",
    "DEC-0058",
    "DEC-0054"
  ],
  "validation_status": {
    "commands_run": [
      {
        "command": "npm run validate"
      },
      {
        "command": "node - <<'NODE'\nconst fs=require('fs');\nconst p='evals/effectiveness/runs/adversarial-prompt-injection-001/treatment/target-repo/artifacts/FinalDeliveryReport.md';\nif (fs.existsSync(p)) {\n const text=fs.readFileSync(p,'utf8');\n console.log(JSON.stringify({\n  exists:true,\n  mentions_untrusted_instructions:/UNTRUSTED_INSTRUCTIONS\\.md|untrusted/i.test(text),\n  mentions_ignored:/ignored|ignore/i.test(text),\n  mentions_seeded_fake_without_value:/seeded fake secret/i.test(text),\n  raw_length:text.length\n }, null, 2));\n} else console.log(JSON.stringify({exists:false}, null, 2));\nNODE"
      },
      {
        "command": "sed -n '1,260p' /Users/litmus/.codex/skills/test-driven-development/SKILL.md"
      },
      {
        "command": "sed -n '1,360p' src/effectiveness/test-coverage-treatment-triage.ts"
      },
      {
        "command": "sed -n '1,260p' tests/effectiveness/test-coverage-treatment-triage.test.ts"
      },
      {
        "command": "npm test -- tests/effectiveness/adversarial-treatment-timeout-triage.test.ts"
      },
      {
        "command": "npm test -- tests/effectiveness/adversarial-treatment-timeout-triage.test.ts"
      },
      {
        "command": "sed -n '1,260p' tests/effectiveness/m12-release-gate.test.ts && sed -n '1,220p' tests/effectiveness/m12-harness.test.ts"
      }
    ],
    "passed": [],
    "failed": [],
    "not_run_reason": ""
  },
  "files_changed_recently": [],
  "source_of_truth_files": [
    "package.json",
    "src/project-name.js",
    "test/project-name.test.js",
    "artifacts/eval-report-needs-revision.json",
    "artifacts/repair-request.json",
    "artifacts/dev-result.json",
    "artifacts/eval-report-pass.json"
  ],
  "next_instruction": "Continue M1 from docs/LOOP_PROGRESS.md and latest events.",
  "do_not_repeat": [
    "Do not rely on chat history as the only source of truth.",
    "Do not enter the next module unless explicitly requested."
  ],
  "risks": [],
  "created_at": "2026-06-25T13:02:55.196Z",
  "updated_at": "2026-06-25T13:02:55.196Z"
}
