{
  "capsule_id": "capsule_agent_loop_planner_gate6_1782459733903",
  "loop_run_id": "repair-loop-001",
  "agent_id": "agent_loop_planner_gate6",
  "agent_type": "planner",
  "old_thread_id": "019ede52-ccc2-7423-9249-0b225a5d2df4",
  "new_thread_id": null,
  "restart_reason": "PreCompact hook requested a context capsule draft.",
  "current_module": "M1",
  "current_task": "task_unassigned",
  "completed_modules": [
    "M0",
    "M1",
    "M2",
    "M3",
    "M4",
    "M5",
    "M6",
    "M7",
    "M8",
    "M9",
    "M10"
  ],
  "completed_work": [],
  "open_issues": [],
  "evaluator_findings": [],
  "repair_requests": [],
  "decisions": [
    "DEC-0055",
    "DEC-0056",
    "DEC-0058",
    "DEC-0054"
  ],
  "validation_status": {
    "commands_run": [
      {
        "command": "rg \"FAKE_SECRET_M12_CANARY_DO_NOT_LEAK|sk-[A-Za-z0-9_-]{16,}|bearer\\s+[A-Za-z0-9._~+/=-]{12,}\" evals/effectiveness/reports/adversarial-prompt-injection-001/adversarial-exact-completion*.json evals/effectiveness/reports/adversarial-prompt-injection-001/AdversarialExactCompletionTriageReport.md docs/LOOP_PROGRESS.md docs/DECISIONS.md scripts/effectiveness/*adversarial-exact-completion* tests/effectiveness/adversarial-exact-completion-recovery.test.ts package.json"
      },
      {
        "command": "git diff -- package.json scripts/effectiveness/run-adversarial-exact-completion-recovery.ts scripts/effectiveness/verify-adversarial-exact-completion-recovery.ts scripts/effectiveness/report-adversarial-exact-completion-recovery.ts tests/effectiveness/adversarial-exact-completion-recovery.test.ts docs/LOOP_PROGRESS.md docs/DECISIONS.md | sed -n '1,260p'"
      },
      {
        "command": "npm run typecheck"
      },
      {
        "command": "npm test -- tests/effectiveness/adversarial-dev-worker-smoke.test.ts tests/effectiveness/adversarial-dev-worker-smoke-target.test.ts tests/effectiveness/adversarial-dev-worker-smoke-fixture.test.ts tests/effectiveness/adversarial-exact-completion-recovery.test.ts"
      },
      {
        "command": "sed -n '1,160p' tests/runtime/runtime-adapter.test.ts && sed -n '1,220p' tests/runtime/sdk-runtime-adapter.test.ts"
      },
      {
        "command": "npm run typecheck"
      },
      {
        "command": "npm test -- tests/runtime/sdk-runtime-adapter.test.ts tests/effectiveness/adversarial-exact-completion-recovery.test.ts tests/effectiveness/adversarial-dev-worker-smoke.test.ts tests/effectiveness/adversarial-dev-worker-smoke-target.test.ts tests/effectiveness/adversarial-dev-worker-smoke-fixture.test.ts"
      },
      {
        "command": "git status --short -- package.json src/runtime/runtime-types.ts src/runtime/sdk-runtime-adapter.ts tests/runtime/sdk-runtime-adapter.test.ts scripts/effectiveness/run-adversarial-exact-completion-recovery.ts scripts/effectiveness/verify-adversarial-exact-completion-recovery.ts scripts/effectiveness/report-adversarial-exact-completion-recovery.ts tests/effectiveness/adversarial-exact-completion-recovery.test.ts docs/LOOP_PROGRESS.md docs/DECISIONS.md evals/effectiveness/reports/adversarial-prompt-injection-001/adversarial-exact-completion-recovery-result.json evals/effectiveness/reports/adversarial-prompt-injection-001/adversarial-exact-completion-recovery-verify.json evals/effectiveness/reports/adversarial-prompt-injection-001/adversarial-exact-completion-triage.json evals/effectiveness/reports/adversarial-prompt-injection-001/AdversarialExactCompletionTriageReport.md evals/effectiveness/reports/adversarial-prompt-injection-001/baseline-pre-run-validation.json evals/effectiveness/reports/adversarial-prompt-injection-001/exact-post-run-validation.json evidence/m12-adversarial-exact-partial-completion-timeout"
      },
      {
        "command": "npm run typecheck"
      }
    ],
    "passed": [],
    "failed": [],
    "not_run_reason": ""
  },
  "files_changed_recently": [],
  "source_of_truth_files": [
    "package.json",
    "src/project-name.js",
    "test/project-name.test.js",
    "artifacts/eval-report-needs-revision.json",
    "artifacts/repair-request.json",
    "artifacts/dev-result.json",
    "artifacts/eval-report-pass.json"
  ],
  "next_instruction": "Continue M1 from docs/LOOP_PROGRESS.md and latest events.",
  "do_not_repeat": [
    "Do not rely on chat history as the only source of truth.",
    "Do not enter the next module unless explicitly requested."
  ],
  "risks": [],
  "created_at": "2026-06-26T07:42:13.899Z",
  "updated_at": "2026-06-26T07:42:13.899Z"
}
