{
  "capsule_id": "capsule_agent_loop_planner_gate6_1782211592830",
  "loop_run_id": "repair-loop-001",
  "agent_id": "agent_loop_planner_gate6",
  "agent_type": "planner",
  "old_thread_id": "019ede52-ccc2-7423-9249-0b225a5d2df4",
  "new_thread_id": null,
  "restart_reason": "PreCompact hook requested a context capsule draft.",
  "current_module": "M1",
  "current_task": "task_unassigned",
  "completed_modules": [
    "M0",
    "M1",
    "M2",
    "M3",
    "M4",
    "M5",
    "M6",
    "M7",
    "M8",
    "M9",
    "M10"
  ],
  "completed_work": [],
  "open_issues": [],
  "evaluator_findings": [],
  "repair_requests": [],
  "decisions": [
    "DEC-0055",
    "DEC-0056",
    "DEC-0058",
    "DEC-0054"
  ],
  "validation_status": {
    "commands_run": [
      {
        "command": "sed -n '1,320p' tests/effectiveness/treatment-generic-feature-runner.test.ts"
      },
      {
        "command": "sed -n '1,320p' tests/effectiveness/next-case-readiness.test.ts"
      },
      {
        "command": "grep -n \"class GenericFeatureFakeAdapter\\|function valid\" -n tests/effectiveness/treatment-generic-feature-runner.test.ts && sed -n '320,760p' tests/effectiveness/treatment-generic-feature-runner.test.ts"
      },
      {
        "command": "sed -n '1,260p' tests/effectiveness/artifact-completeness-grader.test.ts && sed -n '1,320p' tests/effectiveness/m12-harness.test.ts"
      },
      {
        "command": "sed -n '260,620p' tests/effectiveness/m12-harness.test.ts"
      },
      {
        "command": "grep -n \"function validBaselineResult\\|function sampleRun\\|function createTreatmentDryRun\\|writeDatasetCopy\" -n tests/effectiveness/m12-harness.test.ts && sed -n '620,980p' tests/effectiveness/m12-harness.test.ts"
      },
      {
        "command": "sed -n '1,260p' src/orchestrator/validate-dev-worker-result.ts && sed -n '1,220p' src/orchestrator/dev-worker-lite-output.ts && sed -n '1,260p' src/runtime/runtime-types.ts"
      },
      {
        "command": "test -f evals/effectiveness/fixtures/bugfix-small-001/package.json; echo fixture_pkg=$?; grep -n \"prepareM12BugfixFixture\" src/effectiveness/effectiveness-fixtures.ts || true; test -f tests/effectiveness/bugfix-small-001-fixture.test.ts; echo test_file=$?"
      },
      {
        "command": "npm test -- tests/effectiveness/bugfix-small-001-fixture.test.ts"
      },
      {
        "command": "grep -n \"export function validateDevWorkerLiteResult\" src/orchestrator/validate-dev-worker-result.ts && grep -n \"export function validatePlannerLiteArtifacts\" src/orchestrator/validate-planner-artifacts.ts && grep -n \"sdk_method\" -R src/orchestrator/sdk-evaluator-stage-types.ts src/orchestrator/sdk-evaluator-stage.ts"
      }
    ],
    "passed": [],
    "failed": [],
    "not_run_reason": ""
  },
  "files_changed_recently": [],
  "source_of_truth_files": [
    "package.json",
    "src/project-name.js",
    "test/project-name.test.js",
    "artifacts/eval-report-needs-revision.json",
    "artifacts/repair-request.json",
    "artifacts/dev-result.json",
    "artifacts/eval-report-pass.json"
  ],
  "next_instruction": "Continue M1 from docs/LOOP_PROGRESS.md and latest events.",
  "do_not_repeat": [
    "Do not rely on chat history as the only source of truth.",
    "Do not enter the next module unless explicitly requested."
  ],
  "risks": [],
  "created_at": "2026-06-23T10:46:32.829Z",
  "updated_at": "2026-06-23T10:46:32.829Z"
}
